[{"case_commitment":"sha256:e7f7c58c1895ec644f352bf70b2e37a7ce4add40442b653938135ab5fdb46fda","case_id":"identity-00","exception":"","family":"identity","method":"pcug","shortest_path":null,"verdict":"COMPLETE"},{"case_commitment":"sha256:e7f7c58c1895ec644f352bf70b2e37a7ce4add40442b653938135ab5fdb46fda","case_id":"identity-00","exception":"","family":"identity","method":"typed_node_audit","shortest_path":null,"verdict":"COMPLETE"},{"case_commitment":"sha256:e7f7c58c1895ec644f352bf70b2e37a7ce4add40442b653938135ab5fdb46fda","case_id":"identity-00","exception":"","family":"identity","method":"flat_checklist","shortest_path":null,"verdict":"COMPLETE"},{"case_commitment":"sha256:e7f7c58c1895ec644f352bf70b2e37a7ce4add40442b653938135ab5fdb46fda","case_id":"identity-00","exception":"","family":"identity","method":"model_only","shortest_path":null,"verdict":"COMPLETE"},{"case_commitment":"sha256:e7f7c58c1895ec644f352bf70b2e37a7ce4add40442b653938135ab5fdb46fda","case_id":"identity-00","exception":"","family":"identity","method":"receipt_only","shortest_path":null,"verdict":"COMPLETE"},{"case_commitment":"sha256:c1c31ae1522f19cc4d99bbef980d1106795fa0be2f018a900912374b565fb7d3","case_id":"identity-01","exception":"","family":"identity","method":"pcug","shortest_path":["identity-sink-01"],"verdict":"INCOMPLETE"},{"case_commitment":"sha256:c1c31ae1522f19cc4d99bbef980d1106795fa0be2f018a900912374b565fb7d3","case_id":"identity-01","exception":"","family":"identity","method":"typed_node_audit","shortest_path":null,"verdict":"INCOMPLETE"},{"case_commitment":"sha256:c1c31ae1522f19cc4d99bbef980d1106795fa0be2f018a900912374b565fb7d3","case_id":"identity-01","exception":"","family":"identity","method":"flat_checklist","shortest_path":null,"verdict":"COMPLETE"},{"case_commitment":"sha256:c1c31ae1522f19cc4d99bbef980d1106795fa0be2f018a900912374b565fb7d3","case_id":"identity-01","exception":"","family":"identity","method":"model_only","shortest_path":null,"verdict":"COMPLETE"},{"case_commitment":"sha256:c1c31ae1522f19cc4d99bbef980d1106795fa0be2f018a900912374b565fb7d3","case_id":"identity-01","exception":"","family":"identity","method":"receipt_only","shortest_path":null,"verdict":"COMPLETE"},{"case_commitment":"sha256:e4c042c02f9978c660e18d34f282bab34c1c54272a7bcfdf8d87be3b91c976e0","case_id":"identity-02","exception":"","family":"identity","method":"pcug","shortest_path":["identity-sink-02"],"verdict":"INCOMPLETE"},{"case_commitment":"sha256:e4c042c02f9978c660e18d34f282bab34c1c54272a7bcfdf8d87be3b91c976e0","case_id":"identity-02","exception":"","family":"identity","method":"typed_node_audit","shortest_path":null,"verdict":"INCOMPLETE"},{"case_commitment":"sha256:e4c042c02f9978c660e18d34f282bab34c1c54272a7bcfdf8d87be3b91c976e0","case_id":"identity-02","exception":"","family":"identity","method":"flat_checklist","shortest_path":null,"verdict":"COMPLETE"},{"case_commitment":"sha256:e4c042c02f9978c660e18d34f282bab34c1c54272a7bcfdf8d87be3b91c976e0","case_id":"identity-02","exception":"","family":"identity","method":"model_only","shortest_path":null,"verdict":"COMPLETE"},{"case_commitment":"sha256:e4c042c02f9978c660e18d34f282bab34c1c54272a7bcfdf8d87be3b91c976e0","case_id":"identity-02","exception":"","family":"identity","method":"receipt_only","shortest_path":null,"verdict":"COMPLETE"},{"case_commitment":"sha256:777e1a38675163366ea86a42dc1b2bffd195296a1ec619e8d93891fac2905360","case_id":"identity-03","exception":"","family":"identity","method":"pcug","shortest_path":["identity-sink-03"],"verdict":"INCOMPLETE"},{"case_commitment":"sha256:777e1a38675163366ea86a42dc1b2bffd195296a1ec619e8d93891fac2905360","case_id":"identity-03","exception":"","family":"identity","method":"typed_node_audit","shortest_path":null,"verdict":"INCOMPLETE"},{"case_commitment":"sha256:777e1a38675163366ea86a42dc1b2bffd195296a1ec619e8d93891fac2905360","case_id":"identity-03","exception":"","family":"identity","method":"flat_checklist","shortest_path":null,"verdict":"COMPLETE"},{"case_commitment":"sha256:777e1a38675163366ea86a42dc1b2bffd195296a1ec619e8d93891fac2905360","case_id":"identity-03","exception":"","family":"identity","method":"model_only","shortest_path":null,"verdict":"COMPLETE"},{"case_commitment":"sha256:777e1a38675163366ea86a42dc1b2bffd195296a1ec619e8d93891fac2905360","case_id":"identity-03","exception":"","family":"identity","method":"receipt_only","shortest_path":null,"verdict":"COMPLETE"},{"case_commitment":"sha256:fbfa39db041d75e7c37235949d664e36b4b07300fce18e9e38c3edad4487407e","case_id":"identity-04","exception":"","family":"identity","method":"pcug","shortest_path":["identity-sink-04"],"verdict":"UNVERIFIED"},{"case_commitment":"sha256:fbfa39db041d75e7c37235949d664e36b4b07300fce18e9e38c3edad4487407e","case_id":"identity-04","exception":"","family":"identity","method":"typed_node_audit","shortest_path":null,"verdict":"INCOMPLETE"},{"case_commitment":"sha256:fbfa39db041d75e7c37235949d664e36b4b07300fce18e9e38c3edad4487407e","case_id":"identity-04","exception":"","family":"identity","method":"flat_checklist","shortest_path":null,"verdict":"COMPLETE"},{"case_commitment":"sha256:fbfa39db041d75e7c37235949d664e36b4b07300fce18e9e38c3edad4487407e","case_id":"identity-04","exception":"","family":"identity","method":"model_only","shortest_path":null,"verdict":"COMPLETE"},{"case_commitment":"sha256:fbfa39db041d75e7c37235949d664e36b4b07300fce18e9e38c3edad4487407e","case_id":"identity-04","exception":"","family":"identity","method":"receipt_only","shortest_path":null,"verdict":"COMPLETE"},{"case_commitment":"sha256:3f5e8aceea3e9ef14dcd29b0bdb8cab148b3e953eb20b6e693a3f9a70d0e1d8c","case_id":"identity-05","exception":"","family":"identity","method":"pcug","shortest_path":null,"verdict":"COMPLETE"},{"case_commitment":"sha256:3f5e8aceea3e9ef14dcd29b0bdb8cab148b3e953eb20b6e693a3f9a70d0e1d8c","case_id":"identity-05","exception":"","family":"identity","method":"typed_node_audit","shortest_path":null,"verdict":"COMPLETE"},{"case_commitment":"sha256:3f5e8aceea3e9ef14dcd29b0bdb8cab148b3e953eb20b6e693a3f9a70d0e1d8c","case_id":"identity-05","exception":"","family":"identity","method":"flat_checklist","shortest_path":null,"verdict":"COMPLETE"},{"case_commitment":"sha256:3f5e8aceea3e9ef14dcd29b0bdb8cab148b3e953eb20b6e693a3f9a70d0e1d8c","case_id":"identity-05","exception":"","family":"identity","method":"model_only","shortest_path":null,"verdict":"COMPLETE"},{"case_commitment":"sha256:3f5e8aceea3e9ef14dcd29b0bdb8cab148b3e953eb20b6e693a3f9a70d0e1d8c","case_id":"identity-05","exception":"","family":"identity","method":"receipt_only","shortest_path":null,"verdict":"COMPLETE"},{"case_commitment":"sha256:5590fde2ddaafb478a5ec486c625a7645f269fd3b773d0cf72fec365bd072376","case_id":"identity-06","exception":"","family":"identity","method":"pcug","shortest_path":["identity-sink-06"],"verdict":"INCOMPLETE"},{"case_commitment":"sha256:5590fde2ddaafb478a5ec486c625a7645f269fd3b773d0cf72fec365bd072376","case_id":"identity-06","exception":"","family":"identity","method":"typed_node_audit","shortest_path":null,"verdict":"INCOMPLETE"},{"case_commitment":"sha256:5590fde2ddaafb478a5ec486c625a7645f269fd3b773d0cf72fec365bd072376","case_id":"identity-06","exception":"","family":"identity","method":"flat_checklist","shortest_path":null,"verdict":"COMPLETE"},{"case_commitment":"sha256:5590fde2ddaafb478a5ec486c625a7645f269fd3b773d0cf72fec365bd072376","case_id":"identity-06","exception":"","family":"identity","method":"model_only","shortest_path":null,"verdict":"COMPLETE"},{"case_commitment":"sha256:5590fde2ddaafb478a5ec486c625a7645f269fd3b773d0cf72fec365bd072376","case_id":"identity-06","exception":"","family":"identity","method":"receipt_only","shortest_path":null,"verdict":"COMPLETE"},{"case_commitment":"sha256:52f97d8b9bde3bb643672cb38dfdfc13005b49907a6ab877b37572f43434c9b7","case_id":"identity-07","exception":"","family":"identity","method":"pcug","shortest_path":["identity-sink-07"],"verdict":"INCOMPLETE"},{"case_commitment":"sha256:52f97d8b9bde3bb643672cb38dfdfc13005b49907a6ab877b37572f43434c9b7","case_id":"identity-07","exception":"","family":"identity","method":"typed_node_audit","shortest_path":null,"verdict":"INCOMPLETE"},{"case_commitment":"sha256:52f97d8b9bde3bb643672cb38dfdfc13005b49907a6ab877b37572f43434c9b7","case_id":"identity-07","exception":"","family":"identity","method":"flat_checklist","shortest_path":null,"verdict":"COMPLETE"},{"case_commitment":"sha256:52f97d8b9bde3bb643672cb38dfdfc13005b49907a6ab877b37572f43434c9b7","case_id":"identity-07","exception":"","family":"identity","method":"model_only","shortest_path":null,"verdict":"COMPLETE"},{"case_commitment":"sha256:52f97d8b9bde3bb643672cb38dfdfc13005b49907a6ab877b37572f43434c9b7","case_id":"identity-07","exception":"","family":"identity","method":"receipt_only","shortest_path":null,"verdict":"COMPLETE"},{"case_commitment":"sha256:b2cde24788e2204c051460bb273d14fc5395d9748f45f0b282f6bf5f1002bb57","case_id":"identity-08","exception":"","family":"identity","method":"pcug","shortest_path":["identity-sink-08"],"verdict":"INCOMPLETE"},{"case_commitment":"sha256:b2cde24788e2204c051460bb273d14fc5395d9748f45f0b282f6bf5f1002bb57","case_id":"identity-08","exception":"","family":"identity","method":"typed_node_audit","shortest_path":null,"verdict":"INCOMPLETE"},{"case_commitment":"sha256:b2cde24788e2204c051460bb273d14fc5395d9748f45f0b282f6bf5f1002bb57","case_id":"identity-08","exception":"","family":"identity","method":"flat_checklist","shortest_path":null,"verdict":"COMPLETE"},{"case_commitment":"sha256:b2cde24788e2204c051460bb273d14fc5395d9748f45f0b282f6bf5f1002bb57","case_id":"identity-08","exception":"","family":"identity","method":"model_only","shortest_path":null,"verdict":"COMPLETE"},{"case_commitment":"sha256:b2cde24788e2204c051460bb273d14fc5395d9748f45f0b282f6bf5f1002bb57","case_id":"identity-08","exception":"","family":"identity","method":"receipt_only","shortest_path":null,"verdict":"COMPLETE"},{"case_commitment":"sha256:1576a6b819107